slug,title,area,intent,gen,primary_partner,secondary_partner,meta_description,primary_key_word
apartments-in-seville,Apartments Seville,,pillar,,booking,booking,"rental market, move to Spain, flats, relocation",apartments for rent Seville
where-to-live-in-seville,Where to live in Seville,,pillar,,expats,booking,"neighborhood guide, expat areas, safety, local vibe",best districts Seville
monthly-rentals-seville,Monthly rentals in Seville,,pillar,,monthly,booking,"mid-term housing, serviced apartments, no long contract",Seville monthly rentals
seville-district-guide,Seville District Guide,,pillar,,nomads,booking,"guide to neighborhoods, property prices, transport",Seville district map
student-apartments-seville,Student Apartments Seville,,pillar,,students,booking,"near universities, shared flats, budget-friendly, Erasmus",student accommodation Seville
housing-for-expats-seville,Housing For Expats Seville,,pillar,,expats,booking,"English speaking agents, relocation services, luxury rentals",expat housing Seville
digital-nomad-apartments-seville,Digital Nomad Apartments Seville,,pillar,,nomads,booking,"fast wifi, coworking, flexible terms, central location",Seville digital nomad housing
